Key,symptom,factor_group,factor,translation chinese,translation english,
"dizziness, accompanied by slurred speech",Dizziness,Accompanied by,Slurred speech,请问您的眩晕伴随着语言不清的症状吗？,Does your dizziness come with slurred speech?,
"dizziness, accompanied by sweating",Dizziness,Accompanied by,Sweating,请问您的眩晕伴随着出汗的症状吗？,Does your dizziness come with sweating?,
"eye discomfort and redness, eye discomfort best described as achy",Eye discomfort and redness,Eye discomfort best described as,Achy,请问您眼部不适是指眼睛疼痛吗？,Does your eye discomfort refer to eye pain?,
"eye discomfort and redness, eye discomfort best described as dry or itchy",Eye discomfort and redness,Eye discomfort best described as,Dry or itchy,请问您眼部不适是指眼睛干燥或痒吗？,Does your eye discomfort refer to dry or itchy eyes?,
"eye discomfort and redness, eye discomfort best described as gritty sensation",Eye discomfort and redness,Eye discomfort best described as,Gritty sensation,请问您眼部不适是指眼睛有异物感吗？,Does your eye discomfort refer to a sensation of having something in your eye?,
"eye discomfort and redness, eye discomfort best described as redness without actual discomfort",Eye discomfort and redness,Eye discomfort best described as,Redness without actual discomfort,请问您眼部不适是指眼睛红但不痛吗？,Does your eye discomfort refer to redness in the eyes but without pain?,
"eye discomfort and redness, eye discomfort best described as sensitivity to light",Eye discomfort and redness,Eye discomfort best described as,Sensitivity to light,请问您眼部不适最合适的描述是对光敏感吗？,Is the best description of your eye discomfort sensitivity to light?,
"eye discomfort and redness, eye discomfort best described as severe pain",Eye discomfort and redness,Eye discomfort best described as,Severe pain,请问您眼部不适是指眼睛严重疼痛吗？,Does your eye discomfort refer to severe eye pain?,
"eye discomfort and redness, eye discomfort best described as stinging or burning sensation",Eye discomfort and redness,Eye discomfort best described as,Stinging or burning sensation,请问您眼部不适是指眼睛刺痛或有烧灼感吗？,Does your eye discomfort refer to a stinging or burning sensation in the eyes?,
"eye discomfort and redness, appearance of eye includes bleeding on the surface of the white of the eye",Eye discomfort and redness,Appearance of eye includes,Bleeding on the surface of the white of the eye,请问您眼睛表面有出血现象吗？,Do you have bleeding on the surface of your eye?,
"eye discomfort and redness, appearance of eye includes crusted eyelashes after sleeping",Eye discomfort and redness,Appearance of eye includes,Crusted eyelashes after sleeping,请问您睡醒后睫毛上有结痂吗？,Do you have crust on your eyelashes when you wake up?,
"eye discomfort and redness, appearance of eye includes excessive tearing",Eye discomfort and redness,Appearance of eye includes,Excessive tearing,请问您眼泪过多吗？,Do you have excessive tearing?,
"eye discomfort and redness, appearance of eye includes red, painful lump on the eyelid",Eye discomfort and redness,Appearance of eye includes,"Red, painful lump on the eyelid",请问您眼睑上出现红色疼痛的肿块吗？,"Do you have a red, painful lump on your eyelid?",
"eye discomfort and redness, appearance of eye includes redness",Eye discomfort and redness,Appearance of eye includes,Redness,请问您眼睛有出现红润吗？症状表现为眼睛发红，可能因为疲劳、刺激或感染。,"Do your eyes appear bloodshot? This is characterized by redness of the eyes, possibly due to fatigue, irritation, or infection.",
"eye discomfort and redness, appearance of eye includes stringy mucus in or around the eye",Eye discomfort and redness,Appearance of eye includes,Stringy mucus in or around the eye,请问您眼睛或周围有黏液性分泌物吗？,Do you have mucous discharge around your eyes?,
"eye discomfort and redness, appearance of eye includes swelling around the eye",Eye discomfort and redness,Appearance of eye includes,Swelling around the eye,请问您眼睛周围出现肿胀吗？,Do you experience swelling around your eyes?,
"eye discomfort and redness, vision problem includes blurred vision",Eye discomfort and redness,Vision problem includes,Blurred vision,请问您存在视力模糊的问题吗？,Do you have blurred vision?,
"eye discomfort and redness, vision problem includes dark, floating spots in vision",Eye discomfort and redness,Vision problem includes,"Dark, floating spots in vision",请问您的视野中有出现黑色漂浮物吗？,Do you see black spots in your vision?,
"eye discomfort and redness, vision problem includes vision loss",Eye discomfort and redness,Vision problem includes,Vision loss,请问您存在视力丧失的问题吗？,Do you have loss of vision?,
"eye discomfort and redness, triggered by allergens or other irritants",Eye discomfort and redness,Triggered by,Allergens or other irritants,请问您的眼部不适或红眼是由过敏原或其他刺激物引起的吗？,Is your eye discomfort or red eye caused by allergens or other irritants?,
"eye discomfort and redness, triggered by injury or trauma",Eye discomfort and redness,Triggered by,Injury or trauma,请问您的眼部不适或红眼是由受伤或外伤引起的吗？,Is your eye discomfort or red eye caused by injury or trauma?,
"eye discomfort and redness, worsened by dry, warm air",Eye discomfort and redness,Worsened by,"Dry, warm air",请问您的眼部不适或红眼在干燥、热风环境下会加剧吗？,"Does your eye discomfort or red eye worsen in dry, hot air conditions?",
"eye discomfort and redness, worsened by eye movement",Eye discomfort and redness,Worsened by,Eye movement,请问您的眼部不适或红眼在眼球移动时会加剧吗？,Does your eye discomfort or red eye worsen with eye movement?,
"eye discomfort and redness, accompanied by runny or stuffy nose",Eye discomfort and redness,Accompanied by,Runny or stuffy nose,请问您有眼部不适或红眼伴随着流鼻涕或鼻塞吗？,Do you have nasal discharge or congestion along with eye discomfort or red eye?,
"eye problems, problem is blurry distant objects",Eye problems,Problem is,Blurry distant objects,请问您有看远处物体模糊的问题吗？,Do you have a problem with seeing distant objects clearly?,
"eye problems, problem is blurry nearby objects",Eye problems,Problem is,Blurry nearby objects,请问您有看近处物体模糊的问题吗？,Do you have a problem with seeing close objects clearly?,
"eye problems, problem is blurry or blind spot in center of vision",Eye problems,Problem is,Blurry or blind spot in center of vision,请问您有视野中心出现模糊或盲点的问题吗？,Do you have blurriness or a blind spot in the center of your vision?,
"eye problems, problem is blurry vision at all distances",Eye problems,Problem is,Blurry vision at all distances,请问您在所有距离上都感觉视线模糊吗？,Do you have blurry vision at all distances?,
"eye problems, problem is bright zigzag lines",Eye problems,Problem is,Bright zigzag lines,请问您会看到明亮的锯齿形线条吗？,"Do you see bright, jagged lines?",
"eye problems, problem is clouded, hazy or dim vision",Eye problems,Problem is,"Clouded, hazy or dim vision",请问您有视野变得模糊、朦胧或昏暗的问题吗？症状表现为整个视野变得不清晰，好像有雾或阴影遮挡。,"Do you experience a blur, haze, or dimness in your vision? This is characterized by the entire field of vision becoming unclear, as if obscured by fog or a shadow.",
"eye problems, problem is double vision",Eye problems,Problem is,Double vision,请问您有双重视觉的问题吗？症状表现为看任何物体时感觉像是重叠或看到两个相同的图像。,Do you have double vision? This is characterized by seeing an object as double or two identical images.,
"eye problems, problem is fading of colors",Eye problems,Problem is,Fading of colors,请问您有感觉颜色逐渐褪去吗？,Do you feel like colors are fading?,
"eye problems, problem is flashes of light",Eye problems,Problem is,Flashes of light,请问您有看到闪光的光点吗？症状表现为在没有光源的情况下视野中出现闪光或光点。,Do you see flashes of light? This is characterized by seeing flashes or spots of light in the absence of a light source.,
"eye problems, problem is glare with bright lights",Eye problems,Problem is,Glare with bright lights,请问您面对强光时感到眩光吗？症状表现为面对明亮的光源时感觉刺眼或难以睁眼。,Do you experience glare when facing bright lights? This is characterized by discomfort or difficulty opening the eyes in bright light.,
"eye problems, problem is halos around lights",Eye problems,Problem is,Halos around lights,请问您看灯光时周围有光晕吗？症状表现为观察光源时，光源周围出现圆圈或晕影。,Do you see halos around lights? This is characterized by circles or glare seen around a light source.,
"eye problems, problem is inability to distinguish certain shades of color",Eye problems,Problem is,Inability to distinguish certain shades of color,请问您无法区分某些颜色的阴影吗？症状表现为难以区分或识别某些特定颜色或色调。,Are you unable to differentiate certain shades of colors?,
"eye problems, problem is loss of side vision",Eye problems,Problem is,Loss of side vision,请问您有视野缺失或侧视力丧失的问题吗？症状表现为无法看到视野的一侧或周边区域，感觉像是有东西遮挡。,"Do you have loss of peripheral or side vision? This is characterized by the inability to see to one side or the periphery, feeling as though something is blocking your view.",
"eye problems, problem is objects appear crooked or distorted",Eye problems,Problem is,Objects appear crooked or distorted,请问您看到的物体出现扭曲或变形吗？,Do objects appear distorted or warped to you?,
"eye problems, problem is poor night vision",Eye problems,Problem is,Poor night vision,请问您有夜间视力差的问题吗？,Do you have poor night vision?,
"eye problems, problem is progressive expansion of shadow or curtain over visual field",Eye problems,Problem is,Progressive expansion of shadow or curtain over visual field,请问您有视野中逐渐出现阴影或帘幕遮挡的感觉吗？,Do you feel as if a curtain or shadow is descending in your field of vision?,
"eye problems, problem is seeing nonexistent things, or hallucinating",Eye problems,Problem is,"Seeing nonexistent things, or hallucinating",请问您有看到不存在的东西，或出现幻觉的情况吗？,"Do you see things that aren't there, or experience hallucinations?",
"eye problems, problem is sensitivity to light",Eye problems,Problem is,Sensitivity to light,请问您对光线非常敏感吗？症状表现为眼睛对光线反应强烈，可能感到不适或疼痛。,"Are you extremely sensitive to light? This is characterized by a strong reaction of the eyes to light, possibly causing discomfort or pain.",
"eye problems, problem is shimmering spots or stars",Eye problems,Problem is,Shimmering spots or stars,请问您看到闪烁的斑点或星星吗？,Do you see flickering spots or stars?,
"eye problems, problem is spots or strings floating in field of vision",Eye problems,Problem is,Spots or strings floating in field of vision,请问您看到视野中漂浮的斑点或丝状物吗？症状表现为视野中有小黑点或像蜘蛛网一样的结构漂浮。,Do you see floating spots or threads in your vision? This is characterized by seeing small dark spots or web-like structures floating in your vision.,
"eye problems, problem is tunnel vision",Eye problems,Problem is,Tunnel vision,请问您有隧道视觉的感觉吗？症状表现为只能看到直视前方的视野，而周围的视野似乎消失了。,"Do you experience tunnel vision? This is characterized by only being able to see the area directly in front, as if the peripheral vision has disappeared.",
"eye problems, problem is vision loss, partial or total",Eye problems,Problem is,"Vision loss, partial or total",请问您有部分或全部视力丧失的情况吗？症状表现为视力部分或完全丧失，影响日常生活和活动,"Do you have partial or complete loss of vision? This is characterized by partial or total loss of vision, affecting daily life and activities.",
"eye problems, problem affects both eyes",Eye problems,Problem affects,Both eyes,请问您的双眼是否有视觉问题？（指的是视力问题影响到两只眼睛。）,Do you have visual problems affecting both eyes?,
"eye problems, problem affects one eye",Eye problems,Problem affects,One eye,请问您的单眼是否有视觉问题？（指的是视力问题仅影响一只眼睛。）,Do you have visual problems affecting only one eye?,
"eye problems, vision improves somewhat with holding objects away from face",Eye problems,Vision improves somewhat with,Holding objects away from face,当您把物体拿远一些时，视力是否有所改善？（指的是远距离看东西比较清楚，可能提示远视问题。）,Does moving objects farther away improve your vision? (This may indicate farsightedness.),
"eye problems, vision improves somewhat with holding objects close to face",Eye problems,Vision improves somewhat with,Holding objects close to face,当您把物体拿近一些时，视力是否有所改善？（指的是近距离看东西比较清楚，可能提示近视问题。）,Does bringing objects closer improve your vision? (This may indicate nearsightedness.),
"eye problems, vision improves somewhat with squinting",Eye problems,Vision improves somewhat with,Squinting,眯眼时，您的视力是否有所改善？（指的是通过缩小眼睛的开口，改善焦距和视力清晰度。）,Does squinting improve your vision? (This refers to improving focus and clarity by narrowing the eye's aperture.),
"eye problems, vision improves somewhat with use of bright lighting",Eye problems,Vision improves somewhat with,Use of bright lighting,在明亮的光线下，您的视力是否有所改善？（指的是在光线较强时视力变好，可能与光照条件影响视力有关。）,Does your vision improve in bright light? (This may be related to how light conditions affect vision.),
"eye problems, onset is gradual or progressive",Eye problems,Onset is,Gradual or progressive,您的视力问题是否是逐渐出现或持续恶化的？（指的是视力问题不是一下子出现，而是逐渐发展的。）,Is your vision problem gradual or progressively getting worse?,
"eye problems, onset is recent (hours to days)",Eye problems,Onset is,Recent (hours to days),您的视力问题是否是在最近几小时到几天内出现的？,Did your vision problem start in the past few hours to days?,
"eye problems, onset is sudden (seconds to minutes)",Eye problems,Onset is,Sudden (seconds to minutes),您的视力问题是否是突然之间发生的，从几秒到几分钟内？,"Did your vision problem occur suddenly, within seconds to minutes?",
"eye problems, duration is a few minutes",Eye problems,Duration is,A few minutes,您的视力问题是否持续了几分钟？,Does your vision problem last for a few minutes?,
"eye problems, duration is usually no longer than 30 minutes",Eye problems,Duration is,Usually no longer than 30 minutes,您的视力问题通常不超过30分钟吗？,Is your vision problem usually not longer than 30 minutes?,
"eye problems, accompanied by confusion or trouble talking",Eye problems,Accompanied by,Confusion or trouble talking,您的视力问题是否伴随有混乱或说话困难？,Is your vision problem accompanied by confusion or difficulty speaking?,
"eye problems, accompanied by dizziness or difficulty walking",Eye problems,Accompanied by,Dizziness or difficulty walking,您的视力问题是否伴随有头晕或行走困难？,Is your vision problem accompanied by dizziness or difficulty walking?,
"eye problems, accompanied by eye pain or discomfort",Eye problems,Accompanied by,Eye pain or discomfort,您的视力问题是否伴随有眼痛或不适？,Is your vision problem accompanied by eye pain or discomfort?,
"eye problems, accompanied by eye redness",Eye problems,Accompanied by,Eye redness,您的视力问题是否伴随有眼睛红润？,Is your vision problem accompanied by redness in the eyes?,
"eye problems, accompanied by eyestrain",Eye problems,Accompanied by,Eyestrain,您的视力问题是否伴随有眼睛疲劳？,Is your vision problem accompanied by eye fatigue?,
"eye problems, accompanied by headache",Eye problems,Accompanied by,Headache,您的视力问题是否伴随有头痛？,Is your vision problem accompanied by a headache?,
"eye problems, accompanied by numbness or weakness on one side of the body",Eye problems,Accompanied by,Numbness or weakness on one side of the body,您的视力问题是否伴随有身体一侧的麻木或无力？,Is your vision problem accompanied by numbness or weakness on one side of the body?,
"eye problems, accompanied by other sensory disturbances",Eye problems,Accompanied by,Other sensory disturbances,您的视力问题是否伴随有其他感觉异常？,Is your vision problem accompanied by other unusual sensations?,
"eye problems, accompanied by swelling around the eye",Eye problems,Accompanied by,Swelling around the eye,您的视力问题是否伴随有眼周肿胀？,Is your vision problem accompanied by swelling around the eyes?,
"foot pain or ankle pain, located in ankle",Foot pain or ankle pain,Located in,Ankle,请问您的疼痛位于脚踝吗？,Is your pain located at the ankle?,
"foot pain or ankle pain, located in area along edge of toenail",Foot pain or ankle pain,Located in,Area along edge of toenail,请问您的疼痛位于趾甲边缘区域吗？,Is your pain located at the edge of the toenail area?,
"foot pain or ankle pain, located in back of ankle",Foot pain or ankle pain,Located in,Back of ankle,请问您的疼痛位于脚踝后部吗？,Is your pain located at the back of the ankle?,
"foot pain or ankle pain, located in bottom of foot",Foot pain or ankle pain,Located in,Bottom of foot,请问您的疼痛位于脚底吗？,Is your pain located at the sole of your foot?,
"foot pain or ankle pain, located in heel",Foot pain or ankle pain,Located in,Heel,请问您的疼痛位于脚后跟吗？,Is your pain located at the heel of your foot?,
"foot pain or ankle pain, located in middle part of foot",Foot pain or ankle pain,Located in,Middle part of foot,请问您的疼痛位于脚的中部吗？,Is your pain located in the middle part of your foot?,
"foot pain or ankle pain, located in toe or front part of foot",Foot pain or ankle pain,Located in,Toe or front part of foot,请问您的疼痛位于脚趾或脚前部吗？,Is your pain located in the toes or front part of your foot?,
"foot pain or ankle pain, located in whole foot",Foot pain or ankle pain,Located in,Whole foot,请问您的疼痛遍及整个脚部吗？,Does your pain spread throughout the entire foot?,
"foot pain or ankle pain, triggered or worsened by activity or overuse",Foot pain or ankle pain,Triggered or worsened by,Activity or overuse,请问您的脚痛或脚踝痛是由活动过度或使用过度引起的吗？,Is your foot or ankle pain caused by overuse or excessive activity?,
"foot pain or ankle pain, triggered or worsened by ill-fitting shoes",Foot pain or ankle pain,Triggered or worsened by,Ill-fitting shoes,请问您的脚痛或脚踝痛是由不合脚的鞋子引起的吗？,Is your foot or ankle pain caused by ill-fitting shoes?,
"foot pain or ankle pain, triggered or worsened by injury",Foot pain or ankle pain,Triggered or worsened by,Injury,请问您的脚痛或脚踝痛是由受伤引起的吗？,Is your foot or ankle pain caused by an injury?,
"foot pain or ankle pain, triggered or worsened by long periods of rest",Foot pain or ankle pain,Triggered or worsened by,Long periods of rest,请问您的脚痛或脚踝痛是在长时间休息后出现或加重的吗？,Does your foot or ankle pain appear or worsen after a long period of rest?,
"foot pain or ankle pain, accompanied by black-and-blue mark",Foot pain or ankle pain,Accompanied by,Black-and-blue mark,请问您的脚痛或脚踝痛伴有青紫色瘀斑吗？,Does your foot or ankle pain come with purplish-blue bruising?,
"foot pain or ankle pain, accompanied by burning",Foot pain or ankle pain,Accompanied by,Burning,请问您的脚痛或脚踝痛伴有烧灼感吗？,Does your foot or ankle pain come with a burning sensation?,
"foot pain or ankle pain, accompanied by difficulty pushing off with toes",Foot pain or ankle pain,Accompanied by,Difficulty pushing off with toes,请问您在用脚趾推地时有困难吗？,Do you have difficulty pushing off with your toes?,
"foot pain or ankle pain, accompanied by feeling of instability",Foot pain or ankle pain,Accompanied by,Feeling of instability,请问您感觉脚不稳吗？,Do you feel that your foot is unstable?,
"foot pain or ankle pain, accompanied by flattened arch",Foot pain or ankle pain,Accompanied by,Flattened arch,请问您的足弓是否变平了？,Has your arch flattened?,
"foot pain or ankle pain, accompanied by inability to bear weight",Foot pain or ankle pain,Accompanied by,Inability to bear weight,请问您站不住或承受不了体重吗？,Are you unable to stand or bear weight?,
"foot pain or ankle pain, accompanied by joint deformity",Foot pain or ankle pain,Accompanied by,Joint deformity,请问您的关节有变形吗？,Do you have joint deformity?,
"foot pain or ankle pain, accompanied by numbness or tingling",Foot pain or ankle pain,Accompanied by,Numbness or tingling,请问您感觉脚部有麻木或刺痛感吗？,Do you feel numbness or tingling in your foot?,
"foot pain or ankle pain, accompanied by redness",Foot pain or ankle pain,Accompanied by,Redness,请问您的脚痛或脚踝痛伴有红肿吗？,Does your foot or ankle pain come with redness and swelling?,
"foot pain or ankle pain, accompanied by stiffness",Foot pain or ankle pain,Accompanied by,Stiffness,请问您的脚痛或脚踝痛伴有僵硬感吗？,Does your foot or ankle pain come with stiffness?,
"foot pain or ankle pain, accompanied by swelling",Foot pain or ankle pain,Accompanied by,Swelling,请问您的脚痛或脚踝痛伴有肿胀吗？,Does your foot or ankle pain come with swelling?,
"foot pain or ankle pain, accompanied by thickened or rough skin",Foot pain or ankle pain,Accompanied by,Thickened or rough skin,请问您的脚部皮肤是否变厚或变粗糙了？,Has the skin on your foot thickened or become rough?,
"foot pain or ankle pain, accompanied by weakness",Foot pain or ankle pain,Accompanied by,Weakness,请问您感觉脚部无力吗？,Do you feel weakness in your foot?,
"foot swelling or leg swelling, pain best described as dull or achy",Foot swelling or leg swelling,Pain best described as,Dull or achy,请问您的脚或腿肿胀的痛感是钝痛或疼痛吗？,Is the pain in your swollen foot or leg dull or aching?,
"foot swelling or leg swelling, pain best described as gradually worsening",Foot swelling or leg swelling,Pain best described as,Gradually worsening,请问您的脚或腿肿胀的痛感是逐渐加剧的吗？,Is the pain in your swollen foot or leg getting progressively worse?,
"foot swelling or leg swelling, swelling occurs along whole limb",Foot swelling or leg swelling,Swelling occurs,Along whole limb,请问您的肿胀发生在整个肢体上吗？,Is the swelling occurring throughout the limb?,
"foot swelling or leg swelling, swelling occurs around ankle or foot",Foot swelling or leg swelling,Swelling occurs,Around ankle or foot,请问您的肿胀发生在脚踝或脚周围吗？,Is the swelling occurring around the ankle or foot?,
"foot swelling or leg swelling, swelling occurs around knee",Foot swelling or leg swelling,Swelling occurs,Around knee,请问您的肿胀发生在膝周围吗？,Is the swelling occurring around the knee?,
"foot swelling or leg swelling, swelling occurs in both limbs",Foot swelling or leg swelling,Swelling occurs,In both limbs,请问您的肿胀是否发生在双侧肢体上？,Does the swelling occur in both limbs?,
"foot swelling or leg swelling, swelling occurs in one limb",Foot swelling or leg swelling,Swelling occurs,In one limb,请问您的肿胀是否只发生在一个肢体上？,Does the swelling only occur in one limb?,
"foot swelling or leg swelling, triggered or worsened by activity or overuse",Foot swelling or leg swelling,Triggered or worsened by,Activity or overuse,请问您的脚或腿肿胀是由活动过度或使用过度引起或加重的吗？,Is the swelling in your foot or leg caused or worsened by overuse or excessive activity?,
"foot swelling or leg swelling, triggered or worsened by everyday activities",Foot swelling or leg swelling,Triggered or worsened by,Everyday activities,请问您的脚或腿肿胀是由日常活动引起或加重的吗？,Is the swelling in your foot or leg caused or worsened by daily activities?,
"foot swelling or leg swelling, triggered or worsened by injury",Foot swelling or leg swelling,Triggered or worsened by,Injury,请问您的脚或腿肿胀是由受伤引起或加重的吗？,Is the swelling in your foot or leg caused or worsened by an injury?,
"foot swelling or leg swelling, triggered or worsened by movement",Foot swelling or leg swelling,Triggered or worsened by,Movement,请问您的脚或腿肿胀是由移动引起或加重的吗？,Is the swelling in your foot or leg caused or worsened by movement?,
